{
  "_comment": "文件用途：记录 spec-flow-kit 全局状态、active feature、gate 模式和 feature 索引。activeFeature 是当前默认 feature；activeFeature 为 null 时，命令需要显式 FEATURE-ID 或提示用户运行 /sfk-use。gateMode 固定值：advisory、strict。advisory：默认提示模式。strict：严格 gate 模式，必须由用户显式启用。workspace.gitBranch 和 workspace.gitRef 只是元数据，不会自动切换分支。features 条目结构：path、stage、branch、lastUpdatedAt。stage 建议值：requirements、design、plan、development、verification、delivery、completed、blocked。updatedAt 通常由工具维护。",
  "version": 1,
  "activeFeature": null,
  "gateMode": "advisory",
  "workspace": {
    "_comment": "当前工作区信息。gitBranch 和 gitRef 只是元数据，不会触发自动切换分支。",
    "root": ".",
    "gitBranch": null,
    "gitRef": null
  },
  "featuresComment": "Feature 索引。创建 feature 后会按 FEATURE-ID 增加条目，例如 AUTH-LOCK-001。每个条目应包含 path、stage、branch 和 lastUpdatedAt；stage 建议值为 requirements、design、plan、development、verification、delivery、completed、blocked。",
  "features": {},
  "updatedAt": null
}
